{
  "schemaVersion": 1,
  "id": "northmark.shorts.catalog",
  "name": "Northmark Shorts Catalog",
  "version": "1.0.0",
  "contracts": { "arronix": ">=0.9 <0.10" },
  "entryAssembly": "Northmark.Shorts.Catalog.dll",
  "dependencies": [
    { "package": "northmark.shorts", "range": ">=1.0 <2.0" }
  ],
  "description": "A short-film cataloger, built outside the Arronix solution and against the published short-film domain package only.",
  "capabilities": ["metadata"]
}
