{
  "schemaVersion": 1,
  "id": "fixture.movies.provider",
  "name": "Independent movie provider",
  "version": "0.1.0",
  "contracts": { "arronix": ">=0.8 <0.9" },
  "entryAssembly": "Arronix.Architecture.Tests.MovieCatalogerFixture.dll",
  "description": "A separately packaged provider that pairs with the movies media domain and takes nothing from the movies extension.",
  "dependencies": [
    { "package": "movies", "range": ">=0.1 <0.2" }
  ],
  "capabilities": [
    "metadata",
    "curation"
  ]
}
