{
  "schemaVersion": 1,
  "id": "tmdb",
  "name": "TMDb",
  "version": "0.1.0",
  "contracts": { "arronix": ">=0.9 <0.10" },
  "entryAssembly": "Arronix.Provider.Tmdb.dll",
  "description": "A separately packaged TMDb provider, whose movies binding pairs with the movies media domain and takes nothing from the movies extension.",
  "dependencies": [
    { "package": "movies", "range": ">=0.1 <0.2" }
  ],
  "capabilities": [
    "metadata",
    "curation"
  ]
}
