{
  "schemaVersion": 1,
  "id": "sample.movie.catalog",
  "name": "Sample movie catalog",
  "version": "0.1.0",
  "contracts": { "arronix": ">=0.9 <0.10" },
  "entryAssembly": "Arronix.Sample.MovieCatalog.dll",
  "dependencies": [
    { "package": "movies", "range": ">=0.1 <0.2" }
  ],
  "description": "A credential-free sample movie catalog for evaluating an installation. Its titles are invented and belong to this package alone.",
  "capabilities": [
    "metadata"
  ]
}
